{
  "$schema": "https://json-schema.org/draft/2020-12/schema",
  "$id": "urn:openmasu:schema:metric-definition:v0.4",
  "title": "OpenMasu Metric Definition v0.4",
  "type": "object",
  "additionalProperties": false,
  "required": ["metric_name", "metric_definition_version", "anchor_event", "aggregation_time_zone", "value_type", "definition", "rule_bundle_id", "rule_bundle_version", "rule_bundle_hash"],
  "properties": {
    "metric_name": { "type": "string", "pattern": "^[a-z][a-z0-9_]{2,127}$" },
    "metric_definition_version": { "type": "string", "minLength": 1, "maxLength": 64 },
    "anchor_event": { "enum": ["install", "calendar_day"] },
    "aggregation_time_zone": { "$ref": "common.schema.json#/$defs/aggregationTimeZone" },
    "value_type": { "enum": ["money", "ratio", "count"] },
    "currency": { "type": "string", "pattern": "^[A-Z]{3}$" },
    "amount_scale": { "type": "integer", "minimum": 0, "maximum": 18 },
    "ratio_scale": { "type": "integer", "minimum": 0, "maximum": 18 },
    "definition": {
      "type": "object",
      "additionalProperties": false,
      "required": ["calculation", "window", "numerator"],
      "properties": {
        "calculation": { "enum": ["revenue_sum", "revenue_over_cost", "active_installations_over_cohort", "revenue_over_cohort", "cohort_size", "event_count"] },
        "window": {
          "type": "object",
          "additionalProperties": false,
          "required": ["type", "day"],
          "properties": {
            "type": { "enum": ["elapsed", "calendar_day", "activity_day"] },
            "day": { "type": "integer", "minimum": 0, "maximum": 3650 }
          }
        },
        "numerator": { "enum": ["revenue", "active_installations", "cohort_size", "events"] },
        "denominator": { "enum": ["cost", "cohort_size"] },
        "cost_basis": { "const": "cohort_acquisition_day_current_snapshot" }
      }
    },
    "activity_events": { "type": "array", "minItems": 1, "uniqueItems": true, "default": ["session_start"], "items": { "type": "string", "minLength": 1 } },
    "event_names": {
      "type": "array",
      "minItems": 1,
      "uniqueItems": true,
      "items": { "enum": ["click", "install", "skan_postback", "adattributionkit_postback", "deep_link_open"] }
    },
    "grouping_dimensions": {
      "type": "array",
      "minItems": 1,
      "uniqueItems": true,
      "items": { "enum": ["campaign_id", "network", "country", "cohort_date", "metric_date", "attribution_status", "apple_conversion_bucket"] }
    },
    "fraud_policy": { "enum": ["gross", "net"], "default": "gross" },
    "rule_bundle_id": { "$ref": "common.schema.json#/$defs/id" },
    "rule_bundle_version": { "type": "string" },
    "rule_bundle_hash": { "type": "string", "pattern": "^[a-f0-9]{64}$" }
  },
  "allOf": [
    {
      "if": { "properties": { "value_type": { "const": "money" } }, "required": ["value_type"] },
      "then": { "properties": { "currency": {}, "amount_scale": {} }, "required": ["currency", "amount_scale"] },
      "else": {
        "not": {
          "anyOf": [
            { "properties": { "currency": {} }, "required": ["currency"] },
            { "properties": { "amount_scale": {} }, "required": ["amount_scale"] }
          ]
        }
      }
    },
    {
      "if": { "properties": { "value_type": { "const": "ratio" } }, "required": ["value_type"] },
      "then": { "properties": { "ratio_scale": {} }, "required": ["ratio_scale"] }
    },
    {
      "if": {
        "properties": { "definition": { "type": "object", "additionalProperties": true, "properties": { "calculation": { "const": "revenue_over_cost" } }, "required": ["calculation"] } },
        "required": ["definition"]
      },
      "then": {
        "properties": {
          "value_type": { "const": "ratio" },
          "definition": {
            "type": "object",
            "additionalProperties": true,
            "required": ["denominator", "cost_basis"],
            "properties": { "numerator": { "const": "revenue" }, "denominator": { "const": "cost" }, "cost_basis": {} }
          }
        }
      }
    },
    {
      "if": {
        "properties": { "definition": { "type": "object", "additionalProperties": true, "properties": { "calculation": { "const": "active_installations_over_cohort" } }, "required": ["calculation"] } },
        "required": ["definition"]
      },
      "then": {
        "properties": {
          "activity_events": {},
          "value_type": { "const": "ratio" },
          "definition": {
            "type": "object",
            "additionalProperties": true,
            "required": ["denominator"],
            "properties": { "numerator": { "const": "active_installations" }, "denominator": { "const": "cohort_size" } }
          }
        }
      }
    },
    {
      "if": {
        "properties": { "definition": { "type": "object", "additionalProperties": true, "properties": { "calculation": { "const": "revenue_over_cohort" } }, "required": ["calculation"] } },
        "required": ["definition"]
      },
      "then": {
        "properties": {
          "value_type": { "const": "money" },
          "definition": {
            "type": "object",
            "additionalProperties": true,
            "required": ["denominator"],
            "properties": { "numerator": { "const": "revenue" }, "denominator": { "const": "cohort_size" } }
          }
        }
      }
    },
    {
      "if": {
        "properties": { "definition": { "type": "object", "additionalProperties": true, "properties": { "calculation": { "const": "cohort_size" } }, "required": ["calculation"] } },
        "required": ["definition"]
      },
      "then": {
        "properties": {
          "value_type": { "const": "count" },
          "definition": { "type": "object", "additionalProperties": true, "properties": { "numerator": { "const": "cohort_size" } } }
        }
      }
    },
    {
      "if": {
        "properties": { "definition": { "type": "object", "additionalProperties": true, "properties": { "calculation": { "const": "event_count" } }, "required": ["calculation"] } },
        "required": ["definition"]
      },
      "then": {
        "required": ["event_names", "grouping_dimensions"],
        "properties": {
          "anchor_event": { "const": "calendar_day" },
          "value_type": { "const": "count" },
          "event_names": {
            "type": "array",
            "maxItems": 1,
            "items": { "enum": ["click", "install", "skan_postback", "adattributionkit_postback", "deep_link_open"] }
          },
          "grouping_dimensions": { "type": "array", "contains": { "const": "metric_date" } },
          "definition": {
            "type": "object",
            "additionalProperties": true,
            "properties": {
              "numerator": { "const": "events" },
              "window": {
                "type": "object",
                "additionalProperties": true,
                "properties": { "type": { "const": "calendar_day" }, "day": { "const": 0 } }
              }
            }
          }
        }
      },
      "else": {
        "not": { "required": ["event_names"] },
        "properties": {
          "grouping_dimensions": { "type": "array", "not": { "contains": { "const": "metric_date" } } },
          "definition": {
            "type": "object",
            "additionalProperties": true,
            "properties": { "numerator": { "not": { "const": "events" } } }
          }
        }
      }
    },
    {
      "if": {
        "properties": {
          "definition": { "type": "object", "additionalProperties": true, "properties": { "calculation": { "const": "event_count" } }, "required": ["calculation"] },
          "grouping_dimensions": { "type": "array", "contains": { "const": "attribution_status" } }
        },
        "required": ["definition", "grouping_dimensions"]
      },
      "then": {
        "properties": {
          "event_names": { "type": "array", "items": { "enum": ["install", "deep_link_open"] } }
        }
      }
    },
    {
      "if": {
        "properties": {
          "definition": { "type": "object", "additionalProperties": true, "properties": { "calculation": { "const": "event_count" } }, "required": ["calculation"] },
          "event_names": {
            "type": "array",
            "contains": { "enum": ["skan_postback", "adattributionkit_postback"] }
          }
        },
        "required": ["definition", "event_names"]
      },
      "then": {
        "properties": {
          "metric_name": { "enum": ["skan_attributed_installs", "skan_conversion_value_distribution", "aak_attributed_installs"] },
          "aggregation_time_zone": { "const": "UTC" },
          "grouping_dimensions": {
            "type": "array",
            "not": { "contains": { "const": "attribution_status" } }
          }
        }
      }
    },
    {
      "if": { "properties": { "metric_name": { "const": "skan_attributed_installs" } }, "required": ["metric_name"] },
      "then": {
        "required": ["definition", "event_names", "grouping_dimensions"],
        "properties": {
          "metric_definition_version": { "const": "0.3.3" },
          "definition": { "type": "object", "additionalProperties": true, "properties": { "calculation": { "const": "event_count" } }, "required": ["calculation"] },
          "event_names": { "type": "array", "prefixItems": [{ "const": "skan_postback" }], "minItems": 1, "maxItems": 1 },
          "grouping_dimensions": { "type": "array", "prefixItems": [{ "const": "metric_date" }], "minItems": 1, "maxItems": 1 }
        }
      }
    },
    {
      "if": { "properties": { "metric_name": { "const": "skan_conversion_value_distribution" } }, "required": ["metric_name"] },
      "then": {
        "required": ["definition", "event_names", "grouping_dimensions"],
        "properties": {
          "metric_definition_version": { "const": "0.3.3" },
          "definition": { "type": "object", "additionalProperties": true, "properties": { "calculation": { "const": "event_count" } }, "required": ["calculation"] },
          "event_names": { "type": "array", "prefixItems": [{ "const": "skan_postback" }], "minItems": 1, "maxItems": 1 },
          "grouping_dimensions": {
            "type": "array",
            "prefixItems": [{ "const": "metric_date" }, { "const": "apple_conversion_bucket" }],
            "minItems": 2,
            "maxItems": 2
          }
        }
      }
    },
    {
      "if": { "properties": { "metric_name": { "const": "aak_attributed_installs" } }, "required": ["metric_name"] },
      "then": {
        "required": ["definition", "event_names", "grouping_dimensions"],
        "properties": {
          "metric_definition_version": { "const": "0.3.3" },
          "definition": { "type": "object", "additionalProperties": true, "properties": { "calculation": { "const": "event_count" } }, "required": ["calculation"] },
          "event_names": { "type": "array", "prefixItems": [{ "const": "adattributionkit_postback" }], "minItems": 1, "maxItems": 1 },
          "grouping_dimensions": { "type": "array", "prefixItems": [{ "const": "metric_date" }], "minItems": 1, "maxItems": 1 }
        }
      }
    },
    {
      "if": {
        "properties": { "grouping_dimensions": { "type": "array", "contains": { "const": "apple_conversion_bucket" } } },
        "required": ["grouping_dimensions"]
      },
      "then": { "properties": { "metric_name": { "const": "skan_conversion_value_distribution" } } }
    }
  ]
}
