[
  {
    "metric_name": "cohort_install_count",
    "metric_definition_version": "0.3.0",
    "anchor_event": "install",
    "aggregation_time_zone": "UTC",
    "value_type": "count",
    "definition": {
      "calculation": "cohort_size",
      "window": {
        "type": "elapsed",
        "day": 0
      },
      "numerator": "cohort_size"
    },
    "rule_bundle_id": "metric-stage-b",
    "rule_bundle_version": "0.3.0",
    "rule_bundle_hash": "2222222222222222222222222222222222222222222222222222222222222222"
  },
  {
    "metric_name": "cohort_ltv_d7_usd",
    "metric_definition_version": "0.3.0",
    "anchor_event": "install",
    "aggregation_time_zone": "UTC",
    "value_type": "money",
    "currency": "USD",
    "amount_scale": 6,
    "definition": {
      "calculation": "revenue_over_cohort",
      "window": {
        "type": "elapsed",
        "day": 7
      },
      "numerator": "revenue",
      "denominator": "cohort_size"
    },
    "rule_bundle_id": "metric-stage-b",
    "rule_bundle_version": "0.3.0",
    "rule_bundle_hash": "2222222222222222222222222222222222222222222222222222222222222222"
  },
  {
    "metric_name": "d0_install_to_24h_ad_revenue_usd",
    "aggregation_time_zone": "UTC",
    "definition": {
      "calculation": "revenue_sum",
      "window": {
        "type": "elapsed",
        "day": 0
      },
      "numerator": "revenue"
    },
    "metric_definition_version": "0.3.0",
    "anchor_event": "install",
    "value_type": "money",
    "currency": "USD",
    "amount_scale": 6,
    "rule_bundle_id": "metric-default",
    "rule_bundle_version": "0.3.0",
    "rule_bundle_hash": "0000000000000000000000000000000000000000000000000000000000000000"
  },
  {
    "metric_name": "d0_jst_install_calendar_ad_revenue_usd",
    "aggregation_time_zone": "Asia/Tokyo",
    "definition": {
      "calculation": "revenue_sum",
      "window": {
        "type": "calendar_day",
        "day": 0
      },
      "numerator": "revenue"
    },
    "metric_definition_version": "0.3.0",
    "anchor_event": "install",
    "value_type": "money",
    "currency": "USD",
    "amount_scale": 6,
    "rule_bundle_id": "metric-default",
    "rule_bundle_version": "0.3.0",
    "rule_bundle_hash": "0000000000000000000000000000000000000000000000000000000000000000"
  },
  {
    "metric_name": "d0_utc_install_calendar_ad_revenue_usd",
    "aggregation_time_zone": "UTC",
    "definition": {
      "calculation": "revenue_sum",
      "window": {
        "type": "calendar_day",
        "day": 0
      },
      "numerator": "revenue"
    },
    "metric_definition_version": "0.3.0",
    "anchor_event": "install",
    "value_type": "money",
    "currency": "USD",
    "amount_scale": 6,
    "rule_bundle_id": "metric-default",
    "rule_bundle_version": "0.3.0",
    "rule_bundle_hash": "0000000000000000000000000000000000000000000000000000000000000000"
  },
  {
    "metric_name": "d1_roas",
    "metric_definition_version": "0.3.0",
    "anchor_event": "install",
    "aggregation_time_zone": "UTC",
    "value_type": "ratio",
    "ratio_scale": 6,
    "definition": {
      "calculation": "revenue_over_cost",
      "window": {
        "type": "elapsed",
        "day": 1
      },
      "numerator": "revenue",
      "denominator": "cost",
      "cost_basis": "cohort_acquisition_day_current_snapshot"
    },
    "rule_bundle_id": "metric-stage-b",
    "rule_bundle_version": "0.3.0",
    "rule_bundle_hash": "2222222222222222222222222222222222222222222222222222222222222222"
  },
  {
    "metric_name": "d3_roas",
    "metric_definition_version": "0.3.0",
    "anchor_event": "install",
    "aggregation_time_zone": "UTC",
    "value_type": "ratio",
    "ratio_scale": 6,
    "definition": {
      "calculation": "revenue_over_cost",
      "window": {
        "type": "elapsed",
        "day": 3
      },
      "numerator": "revenue",
      "denominator": "cost",
      "cost_basis": "cohort_acquisition_day_current_snapshot"
    },
    "rule_bundle_id": "metric-stage-b",
    "rule_bundle_version": "0.3.0",
    "rule_bundle_hash": "2222222222222222222222222222222222222222222222222222222222222222"
  },
  {
    "metric_name": "d7_roas",
    "metric_definition_version": "0.3.0",
    "anchor_event": "install",
    "aggregation_time_zone": "UTC",
    "value_type": "ratio",
    "ratio_scale": 6,
    "definition": {
      "calculation": "revenue_over_cost",
      "window": {
        "type": "elapsed",
        "day": 7
      },
      "numerator": "revenue",
      "denominator": "cost",
      "cost_basis": "cohort_acquisition_day_current_snapshot"
    },
    "rule_bundle_id": "metric-stage-b",
    "rule_bundle_version": "0.3.0",
    "rule_bundle_hash": "2222222222222222222222222222222222222222222222222222222222222222"
  },
  {
    "metric_name": "retention_d1",
    "metric_definition_version": "0.3.0",
    "anchor_event": "install",
    "aggregation_time_zone": "UTC",
    "value_type": "ratio",
    "ratio_scale": 6,
    "definition": {
      "calculation": "active_installations_over_cohort",
      "window": {
        "type": "activity_day",
        "day": 1
      },
      "numerator": "active_installations",
      "denominator": "cohort_size"
    },
    "activity_events": [
      "session_start"
    ],
    "rule_bundle_id": "metric-stage-b",
    "rule_bundle_version": "0.3.0",
    "rule_bundle_hash": "2222222222222222222222222222222222222222222222222222222222222222"
  },
  {
    "metric_name": "retention_d7",
    "metric_definition_version": "0.3.0",
    "anchor_event": "install",
    "aggregation_time_zone": "UTC",
    "value_type": "ratio",
    "ratio_scale": 6,
    "definition": {
      "calculation": "active_installations_over_cohort",
      "window": {
        "type": "activity_day",
        "day": 7
      },
      "numerator": "active_installations",
      "denominator": "cohort_size"
    },
    "activity_events": [
      "session_start"
    ],
    "rule_bundle_id": "metric-stage-b",
    "rule_bundle_version": "0.3.0",
    "rule_bundle_hash": "2222222222222222222222222222222222222222222222222222222222222222"
  }
]
